commit	target	mae_pp	n	status	description
47ce7ac	ALL_THREE		117/81/81	exploratory	P27 ERROR ANATOMY of the P18 champion, registered DIAGNOSTIC with a stopping rule (parent P26). predictor.py imported UNCHANGED -- all three MAEs byte-identical (account 5.014 / resilience 6.625 / saving 6.831). PEEK-DISCLOSED (reads 2024 residuals; exploratory, cannot produce a keep). (a) BIAS: mean signed error / MAE = account -0.802/5.014 = 0.160 CENTRED; resilience -3.253/6.625 = 0.491 BIASED; saving -4.914/6.831 = 0.719 BIASED. The champion systematically UNDER-predicts both non-account targets -- it is off-centre, not merely noisy. (b) STRUCTURE: the residual is NOT flat across basins. Account MAE 8.447 (low income) / 8.022 (lower-middle) / 4.216 (upper-middle) / 2.141 (high income), and its negative bias is concentrated in Sub-Saharan Africa (-4.403) and low income (-4.289). Saving under-predicts in EVERY region (-1.8 to -6.0), i.e. a broad level shift rather than one basin. Resilience is the least structured (bias -7.4 MENA and -7.0 ECA but +4.8 East Asia -- sign varies by region). (c) CONCENTRATION: top-10 countries carry 26.9% / 32.1% / 33.7% of total absolute error (2.6-3.2x an even split); worst cells account Zambia -21.7, Kyrgyz Republic -21.4, Senegal -17.9, India -15.3; saving Nigeria -26.3, Bulgaria -23.4, China -20.7. (d) BENCHMARK LADDER: skill vs persistence = 10.1% (account) / 0.8% (resilience) / 30.1% (saving); panel-mean MAE 20.1/11.6/11.6; median |actual 2021->2024 change| = 3.405 / 5.761 / 9.234 -- so ONLY saving has a champion MAE below the typical country's actual move; for account and resilience the typical miss still exceeds the typical movement, and resilience is within 0.8% of doing nothing. (e) COMMON FACTOR: cross-target signed-residual correlation account~saving +0.624 (n=81), account~resilience +0.252, resilience~saving +0.155 -- the model misses account and saving on the SAME countries. REGISTERED DECISION RULE FIRES on the first branch (|mean signed| >= 0.25 x MAE on two targets): a systematic component remains, the stream does NOT close, and ONE MORE MECHANISM is owed next cycle. CONSTRAINT recorded with it: the bias is a broad upward level shift that <=2021 history cannot observe (the same regime change P3 and P10 already failed to learn), and any correction fitted to these residuals would be peek-informed and inadmissible -- the next registration must state how its mechanism is estimable from <=2021 data alone.
1e322aa	account_t_d	5.124	117	discard	P28 BASIN-LEVEL DRIFT term (gamma * pop-weighted basin mean change, added before the shrinkage stack; gamma by <=2021 CV on the 2017->2021 transition with drift built from 2014->2017): the CV curve is single-peaked with an INTERIOR minimum at gamma=0.25 and a +0.107pp margin, so both P26 shape conditions passed and the holdout ran -- and the holdout WORSENED 5.014 -> 5.124. Sixth CV->holdout non-transfer and the FIRST to clear the shape screen. Reverted to the P18 champion.
1e322aa	fin17a_17a1_d	6.831	81	discard	P28 basin drift for saving: <=2021 CV margin +0.002pp at gamma=0.25, under the registered 0.05pp bar, so the P26 screening rule BLOCKED the holdout evaluation as designed. Saving unchanged at the P18 champion 6.831; resilience out of scope (no pre-2021 history) at 6.625. STREAM CLOSED after this experiment -- see RESEARCH_LOG.
