commit	target	mae_pp	n	status	description
57ef411	account_t_d	5.576	117	keep	baseline: persistence (2024=2021)
57ef411	fin24aSD_ND	6.682	81	keep	baseline: persistence
57ef411	fin17a_17a1_d	9.767	81	keep	baseline: persistence
3bc74da	account_t_d	6.123	117	discard	P1 damped trend l=0.5: worse (baseline 5.576)
3bc74da	fin17a_17a1_d	8.448	81	discard	P1 damped trend: better (baseline 9.767) but bundled with account regression
691b3df	fin17a_17a1_d	8.448	81	keep	P2 per-target: damped trend for saving only; account/resilience persistence unchanged
253c7b9	fin17a_17a1_d	9.747	81	discard	P3 MM-informed growth model: worse than P2 champion 8.448 - surge is a regime change, not learnable from the 2017-21 transition
00185dd	account_t_d	5.598	117	discard	P4 logit-space damped trend (l=0.5): worse than persistence (5.576) by 0.02pp - deceleration near ceiling already well captured by flat persistence in this window; reverted to P2 champion
5bb5847	fin24aSD_ND	6.625	81	keep	P5 region-shrinkage (k=0.1, CV-selected on account 2017-21 transition): improves resilience over persistence (baseline 6.682); account/saving unchanged from P2
d115a34	account_t_d	5.156	117	keep	P6 region-shrinkage (k=0.1, same CV-selected value as P5): beats persistence account champion (5.576); resilience/saving byte-identical to P5
22b2b85	account_t_d	5.144	117	keep	P7 income-group shrinkage (k=0.1): pre-2021 CV prefers income-group basin (6.97) over region (7.209); beats P6 region-shrink account champion (5.156->5.144); resilience/saving byte-identical
a430a83	fin24aSD_ND	6.802	81	discard	P8 income-group shrinkage for resilience (k=0.1): worse than P5 region-shrink champion (6.625->6.802); the pre-2021 account-CV basin preference (income-group) does NOT transfer to resilience out-of-sample; reverted to P7/P5 champion (region basin for resilience)
40567d8	account_t_d	5.186	117	discard	P9 tune income-group basin k via finer pre-2021 CV grid: CV picks k=0.2 (in-sample 6.743<k=0.1's 6.97) but out-of-sample account MAE 5.186>5.144 (P7) - finer CV overfits the 2017-21 transition, lighter k=0.1 transfers better; reverted to P7 champion (k=0.1)
58e6f88	fin17a_17a1_d	9.767	81	discard	P10 CV-tune saving damped-trend lambda on pre-2021 (2014/2017->2021) transition: CV picks lambda=0.0 (persistence best on the calm pre-2021 window, grid 6.969/7.242/7.656/8.155/8.703) but that gives out-of-sample saving MAE 9.767>8.448 (P2) - the 2021-24 saving SURGE has momentum absent from the 2014-21 dynamics (regime change, echoes P3), so fixed lambda=0.5 transfers better; reverted to P2/P7 champion
7f44e11	fin17a_17a1_d	7.963	81	keep	P11 region-basin shrinkage (k=0.1) on top of the P2 damped trend for saving: pre-2021 CV (saving 2017->2021, persistence base) prefers region (6.584) over none (6.969) and income-group (6.641); out-of-sample saving MAE 8.448->7.963 (-0.485pp); account/resilience byte-identical to P7/P5 champion; shrinkage (noise-correction) transfers across the 2021 regime change where dynamics-tuning (P9/P10) did not
7620a70	fin17a_17a1_d	7.359	81	keep	P12 two-stage shrinkage (region -> income-group, k=0.1 each) on the saving damped trend: pre-2021 CV (saving 2017->2021, persistence base) prefers two-stage (6.505) over single region shrink (6.584); out-of-sample saving MAE 7.963->7.359 (-0.604pp, larger than P11's gain); account/resilience byte-identical to P11 champion; orthogonal basins compound - shrinkage (noise correction) stacks across the regime change where dynamics-tuning did not
1bda919	account_t_d	5.105	117	keep	P13 two-stage shrinkage for account (income-group -> region, k=0.1 each), generalizing P12: pre-2021 CV (account 2017->2021) prefers two-stage (6.958) over single income-group (6.970) — a thin margin; out-of-sample account MAE 5.144->5.105 (-0.039pp); resilience/saving byte-identical; orthogonal-basin stacking transfers to a second target, but the gain is an order of magnitude smaller than saving's (-0.604pp)
1bda919	fin24aSD_ND	6.730	81	discard	P13 two-stage shrinkage for resilience (region -> income-group, k=0.1 each): CV was PROXIED on the account 2017->2021 transition (disclosed deviation — fin24aSD_ND exists only in 2021, so the pre-registered per-target CV is infeasible; P5 precedent) and adopted two-stage (6.955 vs 7.209), but out-of-sample MAE worsened 6.625->6.730; reverted to the P5 single region shrink under the per-target policy — an exact replay of P8: account-transition basin preferences do not transfer to resilience
334f79f	fin17a_17a1_d	7.359	81	discard	P14 saving two-stage shrink STAGE ORDER: pre-2021 CV (saving 2017->2021, persistence base) prefers the incumbent region->income-group (6.505) over the challenger income->region (6.511) by a razor-thin 0.006pp — CV-adoption condition fails at the first gate, so the incumbent order stays; out-of-sample predictions byte-identical to P13 champion (account 5.105 / resilience 6.625 / saving 7.359); stage order is practically irrelevant for stacked orthogonal-basin shrinkage (the two basins nearly commute); reverted predictor.py to P13 champion (1bda919)
9e5fe92	account_t_d	5.105	117	discard	P15 multi-indicator weighted ridge for account (features: 2021 levels of account/g20_any/fin17a_17a1_d, alpha by <=2021 LOO-CV): ridge <=2021 CV MAE 8.655 (flat across alpha 0-300) >> incumbent two-stage shrink CV 6.412, so CV does NOT prefer ridge — adoption fails at first gate; cross-indicator structure adds nothing over own-history shrinkage (fitted coefs 0.845/0.265/-0.228); account stays byte-identical to P13; reverted predictor.py to champion 1bda919
b6f8cf8	fin17a_17a1_d	7.080	81	keep	P16 THIRD-stage shrinkage for saving with a data-driven basin (terciles of the account level = 'digitalization stage'), stacked on the P12 damped trend + region -> income-group shrink, k=0.1 each: pre-2021 CV (saving 2017->2021, persistence base, all basins built at 2017) prefers three-stage (6.408) over two-stage (6.505); out-of-sample saving MAE 7.359->7.080 (-0.279pp); account (5.105) and resilience (6.625) byte-identical to the P13 champion; orthogonal-basin shrinkage compounds a third time and a DATA-DRIVEN basin works alongside the geographic/administrative ones - noise correction keeps transferring across the 2021 regime change where dynamics-tuning (P9/P10) and cross-indicator fits (P15) did not
e3805a5	account_t_d	5.014	117	keep	P17 THIRD-stage shrinkage for ACCOUNT with a data-driven CROSS-INDICATOR basin (terciles of the g20_any digital-payment level), stacked on the P13 income-group -> region shrink, k=0.1 each: pre-2021 CV (account 2017->2021, persistence base, all basins built at 2017) prefers three-stage (6.710) over two-stage (6.958) by a comfortable margin; out-of-sample account MAE 5.105->5.014 (-0.091pp); saving (7.080) and resilience (6.625) byte-identical to the P16 champion. The data-driven third stage GENERALIZES to a second target, and notably its gain (-0.091pp) is LARGER than account's second administrative stage bought (-0.039pp) -- a basin drawn from a different indicator carries more independent signal than a second geographic/administrative cut. Orthogonal-basin noise correction remains the one mechanism transferring across the 2021 regime change (vs P9/P10 dynamics-tuning and P15 cross-indicator ridge, both non-transfers)
1bb3f78	fin17a_17a1_d	6.831	81	keep	P18 FOURTH-stage shrinkage for saving with a SECOND cross-indicator data-driven basin (terciles of the g20_any digital-payment level), stacked on the P16 champion (damped trend + region -> income-group -> account-tercile shrink), k=0.1 at every stage: pre-2021 CV (saving 2017->2021, persistence base, all basins built at 2017) prefers four-stage (6.370) over three-stage (6.408); out-of-sample saving MAE 7.080->6.831 (-0.249pp); account (5.014) and resilience (6.625) byte-identical to the P17 champion. Compounding does NOT stop at three stages and is barely diminishing on this target (stage 3 bought -0.279pp, stage 4 -0.249pp), even though the two data-driven basins (account terciles, g20 terciles) are both digitalization cuts and might have been near-collinear. Orthogonal-basin noise correction remains the one mechanism transferring across the 2021 regime change (vs P9/P10 dynamics-tuning and P15 cross-indicator ridge)
90404fe	account_t_d	5.014	117	discard	P19 FOURTH-stage shrinkage for ACCOUNT with a second cross-indicator data-driven basin (terciles of fin17a_17a1_d, the formal-saving level), mirroring P18's saving design on the P17 champion (income-group -> region -> g20-tercile), k=0.1: the pre-2021 CV (account 2017->2021, persistence base, all basins built at 2017) REJECTS it decisively -- three_stage=6.710 vs four_stage=7.133 (+0.423pp worse), an order of magnitude past P14's razor-thin 0.006pp margin. Adoption condition fails at the first gate, so no 2024 evaluation was run (P14/P15 protocol) and predictor.py reverted to the P18 champion; all three MAEs byte-identical (account 5.014 / resilience 6.625 / saving 6.831). Answer to the registered question: the compounding curve IS target-specific -- saving took four stages, account stops at three.
2240c15	fin17a_17a1_d	6.831	81	discard	P20 FIFTH-stage shrinkage for SAVING on a NON-digitalization data-driven basin (terciles of fin22a_22a1_22g_d, the formal-borrowing level), stacked on the P18 champion (damped trend + region -> income-group -> account-tercile -> g20-tercile), k=0.1: the pre-2021 CV (saving 2017->2021, persistence base, all basins built at 2017) REJECTS it -- four_stage=6.370 vs five_stage=6.644 (+0.274pp worse), 46x P14's razor-thin margin and of the same order as P19's account rejection (+0.423pp). Adoption fails at the first gate, so no 2024 evaluation was run (P14/P15/P19 protocol) and predictor.py reverted to the P18 champion; all three MAEs byte-identical (account 5.014 / resilience 6.625 / saving 6.831). Answer to the registered question: saving's compounding stops at four stages, and the basin material matters -- both basins that PAID for saving are digitalization cuts (account terciles -0.279pp, g20 terciles -0.249pp) while the first NON-digitalization basin tried is actively harmful. Orthogonality alone does not buy a stage; the partition has to track the phenomenon. Consistent with E11 (d_borrow ~ d_saving r=+0.403, the registered risk): borrowing LEVELS mis-partition saving levels even though borrowing CHANGES co-move with saving changes
9c92ea4	account_t_d	5.014	117	discard	P21 FOURTH-stage shrinkage for ACCOUNT on a DIGITALIZATION data-driven basin (terciles of fin32_acc, wage digitalization, 117/117 panel coverage at 2017/2021), stacked on the P17 champion (income-group -> region -> g20-tercile), k=0.1: registered to separate P19's 'target-specific curve' reading from P20's 'basin material' reading, because P19's rejected basin (formal-saving terciles) was a DEPTH indicator, not a digitalization cut. The pre-2021 CV (account 2017->2021, persistence base, all basins built at 2017) REJECTS it too: three_stage=6.710 vs four_stage=6.780 (+0.070pp worse). Adoption fails at the first gate, so no 2024 evaluation was run (P14/P15/P19/P20 protocol) and predictor.py reverted to the P18 champion; all three MAEs byte-identical (account 5.014 / resilience 6.625 / saving 6.831). Answer to the registered question: P19's reading SURVIVES -- account's compounding curve really is exhausted at three stages, and swapping in the best available digitalization basin does not revive it. But the margin is informative: 0.070pp here vs 0.423pp for the depth basin (P19) and 0.274pp for saving's borrowing basin (P20), i.e. basin material still modulates HOW BADLY a rejected stage hurts (a digitalization cut is near-neutral where non-digitalization cuts are clearly harmful) -- it just cannot buy a stage once the target's noise is gone. The two lessons are complementary, not competing: target-specific exhaustion (P19) sets WHETHER another stage is available, basin material (P20) sets how much a wrong stage costs
4b0545b	account_t_d	5.014	117	discard	P22 ROBUST BASIN CENTER: replace the shrinkage target -- the basin's POPULATION-WEIGHTED MEAN, unchanged since P5 -- with the UNWEIGHTED MEDIAN of the basin's member values, at EVERY stage, per target. Registered as an estimator-robustness test rather than a sixth stage, after five consecutive stage experiments (P14/P15/P19/P20/P21) failed to move the champion: if the gains since P11 are genuine noise correction they should survive a robust center; if they are partly a pull from the giant countries (India, China, Indonesia, Nigeria, Pakistan) that gate G6 guards against on the hypothesis side, a robust center would help. The pre-2021 CV (each target's 2017->2021 transition, persistence base, all basins built at 2017, stage membership held at the P18 champion's) REJECTS the median center on BOTH candidate targets, decisively: account three-stage mean=6.710 vs median=7.831 (+1.121pp worse), saving four-stage mean=6.370 vs median=6.872 (+0.502pp worse). Adoption fails at the first gate on both, so no 2024 evaluation was run (P14/P15/P19/P20/P21 protocol) and predictor.py reverted to the P18 champion; all three MAEs byte-identical (account 5.014 / resilience 6.625 / saving 6.831). Resilience was excluded by design (no pre-2021 transition; the account proxy is twice on record as mis-selecting for it, P8/P13). Answer to the registered question, and the FIRST POSITIVE ROBUSTNESS RESULT for the whole P11-P18 stack: the population-weighted mean is the RIGHT basin location and the shrinkage gains are NOT a big-country artifact. The margins are the largest in the entire P-series (1.121pp vs P19's 0.423, P20's 0.274, P21's 0.070, P14's 0.006), i.e. the center statistic matters far more than any stage or basin choice tested to date. Sharper still: the evaluator's MAE is UNWEIGHTED across countries, so an unweighted median center was if anything favoured by the metric and still lost heavily -- the population weighting is doing real work inside the basin, not just aligning with the scoring rule. Follow-up left untested: a WEIGHTED median, the middle option between the two extremes compared here
6fa476e	account_t_d	5.023	117	discard	P23 POPULATION-WEIGHTED MEDIAN basin center (P22's declared middle option), every stage, account 3-stage stack: the <=2021 CV PREFERS it decisively (mean 6.710 -> wmedian 6.229, margin -0.481 -- larger than any adopted stage gain in the P-series) but the 2021->2024 holdout worsens 5.014 -> 5.023 (+0.009pp). Keep condition requires CV AND holdout; reverted to the P18 champion. Fourth CV->holdout non-transfer (P8, P9, P13, P23).
6fa476e	fin17a_17a1_d	6.864	81	discard	P23 population-weighted median basin center, saving 4-stage stack: <=2021 CV prefers it (mean 6.370 -> wmedian 5.980, margin -0.390) but the holdout worsens 6.831 -> 6.864 (+0.033pp); reverted to the P18 champion. MARGIN COMPARISON (the registered question): P22's UNWEIGHTED median was CV-rejected by +1.120 (account) / +0.502 (saving); re-attaching the population weighting flips both to -0.481 / -0.390 preferred -- so what P22 detected was the WEIGHTING, not the mean-vs-median functional form. Resilience byte-identical at 6.625 throughout.
ae417d5	account_t_d	5.014	117	discard	P24 EMPIRICAL-BAYES ADAPTIVE shrinkage weight k_g = neff_g/(neff_g+m) at every stage (neff = Kish effective n of the basin population weights), m by <=2021 CV over {50,150,500,1500,5000}: CV REJECTS on both targets at every grid point (account constant_k 6.710 vs best 6.995, margin +0.284; saving 6.370 vs 6.419, margin +0.049), so no target adopts and the holdout is byte-identical to the P18 champion. Diagnostic: basin Kish neff is 1.6-9.5 (upper-middle-income 32 countries -> neff 2.77; South Asia 5 -> 1.61), so k_g < 0.1 at every grid point -- the grid conflated reliability-grading with a tenfold cut in average shrinkage. Shrinkage-neutral variant registered for a later cycle. predictor.py reverted to P18 and verified.
ae417d5	fin17a_17a1_d	6.831	81	discard	P24 EMPIRICAL-BAYES ADAPTIVE shrinkage weight k_g = neff_g/(neff_g+m) at every stage (neff = Kish effective n of the basin population weights), m by <=2021 CV over {50,150,500,1500,5000}: CV REJECTS on both targets at every grid point (account constant_k 6.710 vs best 6.995, margin +0.284; saving 6.370 vs 6.419, margin +0.049), so no target adopts and the holdout is byte-identical to the P18 champion. Diagnostic: basin Kish neff is 1.6-9.5 (upper-middle-income 32 countries -> neff 2.77; South Asia 5 -> 1.61), so k_g < 0.1 at every grid point -- the grid conflated reliability-grading with a tenfold cut in average shrinkage. Shrinkage-neutral variant registered for a later cycle. predictor.py reverted to P18 and verified.
1bb3f78	account_t_d	5.014	117	discard	P25 SHRINKAGE-NEUTRAL empirical-Bayes grading: k_g = 0.1 * k_raw_g/mean_w(k_raw) with k_raw_g = neff_g/(neff_g+m), so the pop-weighted mean shrinkage is EXACTLY the incumbent 0.1 and only the RELATIVE grading across basins varies (the variant P24 registered for a later cycle). Grid m in {1,3,10,30,100,1000}; m->0 nests the incumbent constant exactly. <=2021 CV (2017->2021, 3-stage income->region->g20 terciles) prefers constant_k=6.710 over every point (m=1: 6.784 ... m=1000: 7.179), best margin +0.073 on the WRONG side and MONOTONE in grading strength. No adoption, holdout byte-identical at 5.014; reverted to the P18 champion.
1bb3f78	fin17a_17a1_d	6.831	81	discard	P25 shrinkage-neutral grading, saving 4-stage (region->income->account terciles->g20 terciles): <=2021 CV prefers constant_k=6.370 over every grid point (m=1: 6.394 ... m=1000: 6.805), best margin +0.024, again monotone in grading strength. Holdout byte-identical at 6.831. CLOSES THE ADAPTIVE-K AXIS: P24 (unnormalized) and P25 (level-confound removed, incumbent nested) both reject, so Kish neff carries no usable information about how hard a basin should pull. With P22/P23 (basin center) and P9 (global constant) also rejected, every knob on the shrinkage operator except the BASINS THEMSELVES has been tested and none beats k=0.1.
45638d5	account_t_d	5.014	117	discard	P26 CV-SELECTED BIN COUNT for the data-driven shrinkage basins (grid B in {2,3,4,5,6}, one shared B per target applied to all data-driven stages, B=3 nesting the incumbent tercile exactly; administrative region/income basins unchanged): the <=2021 CV (account 2017->2021, persistence base, 3-stage income->region->g20 B-tiles, basins built at 2017) prefers the INCUMBENT B=3 with a clean single-peaked interior optimum -- B=2: 7.052 / B=3: 6.710 / B=4: 6.906 / B=5: 6.959 / B=6: 6.905. Adoption fails at the first gate, no 2024 evaluation for this target (P14/P15/P19/P20/P21 protocol); holdout byte-identical at 5.014. Answer for account: the tercile is a TUNED choice, not an arbitrary one -- both coarser and finer partitions are strictly worse and the curve has one minimum.
45638d5	fin17a_17a1_d	7.024	81	discard	P26 bin count, saving 4-stage stack (region->income->account B-tiles->g20 B-tiles): the <=2021 CV STRICTLY PREFERS B=6 over the incumbent (6.310 vs 6.370, margin -0.060), so the holdout WAS evaluated per the adoption rule -- and it WORSENS 6.831 -> 7.024 (+0.193pp). Keep condition requires CV AND holdout; reverted to the P18 champion (1bb3f78) and re-run to verify byte-identical output (account 5.014 / resilience 6.625 / saving 6.831). FIFTH CV->holdout non-transfer on record (P8, P9, P13, P23, P26). The saving CV curve is NON-MONOTONE and bimodal -- 7.080 / 6.370 / 6.454 / 6.553 / 6.310 -- with B=3 and B=6 as two local minima separated by a hump, which is the signature of CV noise rather than a resolution signal; account, by contrast, gives a clean single-peaked optimum at B=3. Reading: a -0.060 margin on a bimodal curve at neff~7 is not a preference, and the incumbent tercile survives on both targets. The RESOLUTION axis joins adaptive-k (P24/P25), basin center (P22/P23) and the global constant (P9) as tested and closed; what remains live is only WHICH indicator a basin is drawn from.
